<!ELEMENT bookinfo (title, author, isbn, publisher, pubdate, edition, price)>
<!ELEMENT title (#PCDATA)>
<!ELEMENT author (#PCDATA)>
<!ELEMENT isbn (#PCDATA)>
<!ELEMENT publisher (#PCDATA)>
<!ELEMENT pubdate (#PCDATA)>
<!ELEMENT edition (#PCDATA)>
<!ELEMENT price (#PCDATA)>
<!ATTLIST price currency CDATA #REQUIRED>